{
  "version": "1.1",
  "updated": "2026-10-17",
  "privacy_rule": "Public machine-readable status only. Signed agreements, signatures, government IDs, dates of birth, contact details and signing audit trails remain private.",
  "records": [
    {
      "rights_record_id": "RIGHTS-DAN-001-operator-attestation-v1",
      "subject_id": "DAN-001",
      "public_name": "DANISAN",
      "relationship": "collaborating_model",
      "project_refs": [
        "AIO-001"
      ],
      "agreement_type": "participant_image_ai_consent",
      "agreement_version": "signed_copy_version_pending_match",
      "execution_status": "signing_reported_by_administrator_pending_private_evidence_match",
      "executed_at": null,
      "expires_at": null,
      "document_public": false,
      "private_evidence_on_file": false,
      "document_hash_sha256": null,
      "scopes": {
        "image_capture_use": "unknown",
        "ordinary_editing": "unknown",
        "creative_ai_transformation": "unknown",
        "natural_voice_use": "unknown",
        "persistent_voice_clone": "separate_consent_required",
        "dedicated_reusable_identity_model": "separate_consent_required",
        "paid_advertising": "separate_consent_required",
        "third_party_licensing": "separate_consent_required",
        "political_electoral_use": "prohibited",
        "sexual_intimate_content": "prohibited"
      },
      "non_relationship_claims": [
        "This record does not establish employment.",
        "This record does not establish partnership/shareholding.",
        "This record does not establish agency, exclusive representation or spokesperson status."
      ],
      "verification_note": "The project administrator reports that both parties signed the DAN-001 agreement with identifying details. This is an operator attestation, not independent verification; the signed-file version, audit trail, SHA-256 and evidence location have not yet been reconciled with the private Vault. No new signature is requested. Scoped image and promotional permissions remain tied to the signed agreement and individual authorized assets."
    },
    {
      "rights_record_id": "RIGHTS-MC-001-v1",
      "subject_id": "MC-001",
      "public_name": "Marii Cuadros",
      "relationship": "self_rights_holder",
      "project_refs": [
        "AIO-001",
        "VOID-001"
      ],
      "agreement_type": "self_image_ai_authorization",
      "agreement_version": "1.0",
      "execution_status": "prepared_pending_signature",
      "executed_at": null,
      "expires_at": null,
      "document_public": false,
      "private_evidence_on_file": false,
      "document_hash_sha256": null,
      "scopes": {
        "image_capture_use": "unknown",
        "ordinary_editing": "unknown",
        "creative_ai_transformation": "unknown",
        "natural_voice_use": "unknown",
        "persistent_voice_clone": "separate_consent_required",
        "dedicated_reusable_identity_model": "separate_consent_required",
        "paid_advertising": "unknown",
        "third_party_licensing": "separate_consent_required",
        "political_electoral_use": "prohibited",
        "sexual_intimate_content": "prohibited"
      },
      "non_relationship_claims": [
        "Self-authorization does not replace third-party rights, platform rules or applicable law."
      ],
      "verification_note": "Self-authorization form has been prepared. Status remains pending until execution evidence is stored privately."
    }
  ]
}
